{"algorithm":"sha256","content_identity":"sha256:d24eecd24368396dc800360d5a8081a367cebdbfc31d6e5a2ac651ee108d49e1","entries":[{"media_type":"application/json","path":"manifest.json","sha256":"sha256:bc3e5123f8948c6b4c08845ccaae28118b33e3b18cfadf43bfee732e52110c91","uncompressed_bytes":741},{"media_type":"application/x-ndjson","path":"public/events.ndjson","sha256":"sha256:173649922f9c0d23a7000e7b13ea66e9b9f8f3b603e6041a32a16cd4552f6a4a","uncompressed_bytes":10534},{"media_type":"application/json","path":"public/summary.json","sha256":"sha256:d69ee7ca5d0295c751b13b80e7143c036895e2f0821791aef7259e2d737ed66d","uncompressed_bytes":517},{"media_type":"application/json","path":"public/workflow.graph.json","sha256":"sha256:9f0e05d9b8372904f9abc150b430ff9aa67a73c46db7d07309238448be7f0539","uncompressed_bytes":654}],"format":"nemoir.trace.integrity/0.1"}