{"algorithm":"sha256","content_identity":"sha256:168cceb6d53a7318054d6a87ab977ea651c3f19adb4bf252af7793de3e535d95","entries":[{"media_type":"application/json","path":"manifest.json","sha256":"sha256:502979c7ba472002f9ca57dfc3015c4b725e48d322ca74a30288bd6a88c60bc3","uncompressed_bytes":838},{"media_type":"application/x-ndjson","path":"public/events.ndjson","sha256":"sha256:9d415d143eb94caa79e48764c5b5c657bf81ec89d44f15bbab385cbe8d29a405","uncompressed_bytes":1501},{"media_type":"application/json","path":"public/summary.json","sha256":"sha256:ba50e77c5268d6b450535c27512ffec9929f4d9def37ca72a7cb4526cf035e64","uncompressed_bytes":308},{"media_type":"application/json","path":"public/workflow.graph.json","sha256":"sha256:07608ea001ce9a09c258deb8111751f2bfaa600721a1bf2d9f33e965f139bee6","uncompressed_bytes":260}],"format":"nemoir.trace.integrity/0.1"}